Job ID,Date,Company Name,Post,Location,Description,Level,Type,Function,Industry
2473734578,2021-03-09,The Walt Disney Company Graphic,Graphic Designer & Product Manager - 6 Month FTC,"Milan, Lombardy, Italy","Job DescriptionThe Opportunity & Responsibilities:Accountable for the product development strategy and execution for all sub-categories within the Italian market. This role is crucial to ensure compelling products and ideal ranges are developed through our licensing partners and brought to market.Working with the Senior Manager Creative, formulate strategy and be responsible for the delivery and execution of product development for all sub-categories. Act as pivotal pinpoint person - provide product directions, working directly with Category Managers, Licensees and Retailers. Ensure alignment with business priorities, franchise strategies and European direction supplied by the Regional Creative Team.Take overall responsibility for inspired range development including shapes and key items, fabrication and product features as well as application of creative assets, including designs, colours and print techniques. Create inspirational pitches in order to meet licensee’s creative needs and catch new business opportunities. Work closely with the Category Managers to push manufacturing boundaries and ensure innovative integrated and compelling product design. Ensure benefits of product are reflective of value.Define necessary forums and processes to ensure appropriate involvement in product. Be responsible of the whole approval process ensuring feedback is given in a constructive and timely manner.Act as the brand ambassador – ensure brand guidelines are met including character integrity and legal restrictions through all forms of communication. As well as product, this includes packaging architecture, advertising, catalogues and in-store POP.Maintain and share knowledge of licensee manufacturing capabilities and utilise this information to educate and gain the most from licensees and key partners.Liaise with key account contacts and attend meetings. Define and develop needs for key account pitches and deliver presentations with market lead when required.Brief and manage third parties and external design resources when required.By submitting your interest in this job, you agree to receive text notifications with additional steps to complete your job application. You will receive up to 6 messages from the number ""63879"". Message & data rates may apply. Please refer to our privacy policy for more information.",Entry level,Full-time,DesignArt/CreativeInformation Technology,Higher EducationStaffing and RecruitingGovernment Administration
2435724712,2021-03-08,Bottega Veneta Graphic,Bottega Veneta - Junior Graphic Designer,"Milan, Lombardy, Italy","SummaryJob DescriptionAbout usBottega Veneta – Inspiring individuality with innovative craftsmanship since 1966. Under the direction of Daniel Lee creativity lies at the heart of all that we do. Born in Vicenza the house is rooted in Italian culture yet maintains a truly global outlook. An inclusive brand with exclusive products Bottega Veneta is as much of a feeling as it is an aesthetic.We are currently seeking a Junior Graphic Designer as part of our dynamic team in Milan.How you will contribute?Supporting the Art Team in planning concepts by studying relevant information and materials.Illustrating concepts by designing examples of art arrangement, size, type size and style and submitting them for approval.Preparing finished art by operating necessary equipment and software.Coordinating with outside agencies, art services, web designer, marketing, printers, and colleagues as necessary.Contributing to team efforts by accomplishing tasks as needed.Communicating with other departments about layout and design as needed.Creating a wide range of graphics and layouts for product illustrations, company logos, and websites with software such as photoshop.Reviewing final layouts and suggesting improvements when necessary.Who you are?Bachelor’s degree in graphic design or related fieldApproximately 2 - 3 years of experience as a graphic designerWith a High Luxury and disruptive sensitivity aligned with the house new DNADemonstrable graphic design skills with a strong portfolioProficiency with required desktop publishing tools, including Photoshop, InDesign, and IllustratorProficiency in the creation of animations/videos and ability to use programs such as Premiere and AfterEffectsA strong eye for visual compositionPostproduction and retouching skills are a plusEffective time management skills and the ability to meet deadlinesUnderstanding of website design, corporate identity, product packaging, advertisements, and multimedia design.Experience with computer-aided design.Highly organized, very autonomous and able to work on different projects at the same timeFluent in EnglishOnly applications including a Portfolio will be consideredWhy work with us?This is a fabulous opportunity to join the Kering adventure and to actively contribute to the development of the business by becoming part of a global Luxury Group that offers endless possibilities to learn and grow. Talent development is a managerial principle at Kering and we are committed to fostering internal mobility. Our common vision promotes leadership skills and helps every employee to reach their full potential in a stimulating and fulfilling workplace environment.Kering is committed to building a diverse workforce. We believe diversity in all its forms – gender, age, nationality, culture, religious beliefs and sexual orientation – enriches the workplace. It opens up opportunities for people to express their talent, both individually and collectively and it helps foster our ability to adapt to a changing world. As an Equal Opportunity Employer we welcome and consider applications from all qualified candidates, regardless of their background.  Job TypeRegularStart Date2021-04-15ScheduleFull timeOrganizationBOTTEGA VENETA S.R.L.",Entry level,Full-time,DesignArt/CreativeInformation Technology,Luxury Goods & Jewelry
2449540054,2021-03-06,The Luxury Collection Graphic,Director Of Marketing - Excelsior Hotel Gallia,"Milan, Lombardy, Italy","JOB SUMMARY The Director of Marketing is responsible for the planning, direction, control, and coordination of all communication activities, with an emphasis on public relations. Promotes and maintains good communications in order to enhance the prestigious image of the hotel and by doing so contributes to the revenues of the hotel. CANDIDATE PROFILE Education and Experience Required: High school diploma or GED; 4 years experience in the sales and marketing, guest services, front desk, or related professional area. OR 2-year degree from an accredited university in Business Administration and Marketing, 2 years experience in the sales and marketing for Luxury Hotels or other luxury brands outside the hospitality industry. CORE WORK ACTIVITIES Managing Marketing Communications Activities Develops an annual communications plan with specific goals and budgets as outlined in the hotel's marketing plan/communications manual. Prepares working plans to achieve goals and ensures the communications team is fully briefed on goals and progress. Compares actual achievements against goals on a regular basis and takes corrective action. Plans all mailing activities, and oversees their execution. Ensures that the corporate ID manual is kept up-to-date and implemented as appropriate. Prepares on a timely basis the monthly sales & marketing “communications” report. Supervises and directs photography for advertising, collateral and public relations purposes the advertising agency and the field marketing department at corporate office. Ensures the department has a comprehensive master slide/photo/CD library for all advertising, collateral and public relations activities, and regularly sends these to corporate office for the image library. Supervises operations of the in-house art department. Monitors activities of competitor hotels and trends within the industry. Managing Public Relations Activities Acts as official spokesperson for the hotel when appropriate and responds to all media requests within 24 hours. Compiles and maintains a comprehensive list of media contacts and manages them as per the media account management system. Delegates assigned accounts to communications staff as appropriate but takes full responsibility for the key media by maintaining and developing close relationships Prepares press releases for appropriate targeted media, locally, regionally and internationally. Works closely with the corporate and international press offices on developing story angles. Plays a key role in community and government relations as well as VIP handling. Secures opportunities, directs and attends hotel sponsored events, and develops targeted partner relationships. Creates and organizes press promotional activities. Participates in the press events/trips organized by the regional PR offices as required. Conducts press blitzes when appropriate. Ensures press kit information is comprehensive and kept up-to-date. Managing Advertising Activities Works with the team and advertising agency on the rooms and food & beverage tactical advertising campaigns' creative and media plans. Maximizes advertising budget by ensuring that the hotel's creative message and media activities are consistent with the advertising of sister hotels and the company group advertising. Ensures that the advertising creative is in synergy with the company, projecting a consistent and quality message. Reviews the hotel's market segmentation and other appropriate marketing reports to ensure that the media scheduling matches those segments. Monitors and maintains media schedules as well as prompt settlement of accounts. Managing Direct Marketing Activities Takes an integrated approach to DM activities, ensuring a consistent and quality image is projected. Plans, implements and tracks electronic marketing activities. Maintains budget control. Manages Collateral Coordinates and executes production of all printed materials, with assistance of advertising agencies, following the specifications stipulated in the corporate ID manual. Ensures hotel information is updated regularly on the internet/intranet. Supervises the production and quality of all displays and temporary signage in hotel public areas. Supervises and budgets for quality gift items as appropriate. Ensures correct usage of hotel logo on gift items as stipulated in corporate ID manual. Supervises the in-house graphic designer and/or print shop. Marriott International is an equal opportunity employer. We believe in hiring a diverse workforce and sustaining an inclusive, people-first culture. We are committed to non-discrimination on any protected basis, such as disability and veteran status, or any other basis covered under applicable law.",Director,Full-time,MarketingSales,Luxury Goods & JewelryInformation Technology and Services
2449036370,2021-03-05,GameStop Italia Graphic,Stage Graphic Designer - Milan,"Milan, Lombardy, Italy","GameStop Italy S.r.l, multinazionale leader nel mondo dei videogiochi, ricerca per la sede di  Buccinasco  una persona da inserire in  stage  nella Divisione Marketing con il ruolo di  Graphic Designer .La risorsa sarà di supporto al team grafico nelle seguenti attività:  strutturare , secondo guidelines aziendali condivise,  newsletter  e  DEM  ingaggianti;   realizzare banner, landing ed  elementi web per il sito aziendale;  realizzare  composizioni grafiche per campagne e  advertising  mirati;  creare grafiche per  volantini ,  poster , brochure ed  elementi di layout per i negozi della catena;  migliorare la user experience della comunicazione aziendale.I Requisiti Richiesti Sono neo diplomato o neo laureato in  Grafica/Comunicazione o affini;  conoscenza dei  trend social e delle basi del  digital marketing ;  padronanza della suite Adobe, in particolare degli applicativi  Photoshop, Illustrator, Indesign ;  doti di  autonomia , organizzazione e  problem solving ;  orientamento agli obiettivi;  automunito/a (necessario mezzo proprio per raggiungere la sede di lavoro)Ricerchiamo persone dinamiche e positive, con pregressi studi in Grafica / Comunicazione / Nuove Tecnologie e voglia di  lavorare in team ! La risorsa ideale ha una buona conoscenza del mondo video-ludico.L'orario di lavoro  full-time , con disponibilità  dal Lunedì al Venerdì .",Entry level,Full-time,DesignArt/CreativeInformation Technology,N/A
2448093010,2021-03-05,BOGGI MILANO Graphic,Stagista graphic designer/grafico/digital,"Monza, Lombardy, Italy","GRAPHIC DESIGNER / GRAFICOAll’interno dell’In-House Agency di Boggi Milano, si occuperà dell’elaborazione grafica dei progetti di comunicazione BTL e ATL per il Brand. Deve possedere l’esperienza necessaria per progettare, creare e produrre in autonomia ed in gruppo i progetti gli verranno affidatiMansioni principali:• Seguire tutte le fasi di un progetto dal concept creativo alla realizzazione dei materiali facendo riferimento al Direttore Creativo ed al Head of in House Agency• Propensione alla creatività e alla ricerca.• Capacità di gestire in piena autonomia la grafica e l’editing delle immagini di campagne stampa, affissioni, cataloghi, eventi, materiali istituzionali, asset digital.• Progettare e sviluppare l’immagine coordinata (loghi, brand identity e presentazioni aziendali) • preparare correttamente i materiali per andare online  Requisiti richiesti:• Laurea o un diploma in Graphic Design con esperienza è superiore ai 3 anni.• Predisposizione a lavorare in team• Ottima conoscenza della Creative Suite Adobe (Photoshop, Illustrator, Indesign) e dei software di motion graphic/video editing.Da privilegiarsi risorse con competenza   di HTML e CSS.• Organizzazione e massima precisione• Buona conoscenza della lingua inglese Saranno considerate candidature, con breve lettera di presentazione e CV corredati da portfolio (in formato .pdf o consultabile tramite sito web), autorizzazione trattamento dati personali e che rispecchino effettivamente la figura ricercata.Sede di lavoro Monza ",Mid-Senior level,Full-time,Marketing,RetailApparel & FashionLuxury Goods & Jewelry
2479865410,2021-03-02,Adevinta Graphic,Digital UX Product Designer,"Milan, Lombardy, Italy","Company DescriptionSubito is the number 1 place for buying and selling in Italy. We were founded in Milan in 2007 and today, in our country, we are stably positioned in the top 10 most-visited online brands, and as the first for classified ad posting (source: Media Audiweb Total Digital Audience 2018). Our objective has always been to offer an online buying and selling experience which is the simplest, fastest and most secure in Italy. With Subito, everyone: from those making their first transaction to professional sellers and companies, succeed in doing business, and a good deal is often a synonym for a dream being realised. We owe the great results we have achieved to an intuitive and efficient platform and to a wide and high-quality offer, with moderated content for maximum security. And of course, to a tireless team of people who work with a passion for our users. Subito is part of Adevinta, the multinational organization with successful operations in 12 countries in the field of online marketplaces (websites of classified ads and digital services).Job DescriptionWe’re looking for a passionate and experienced Product Designer. As Product Designer you’ll be part of the UX Team within the Subito Product department. Working under the guidance of a UX Supervisor you will have the responsibility to design and validate experiences which are simple, useful and lovable. You will be part of a multi-disciplinary team having specific business goals to achieve. You will work closely with Product, Data, Marketing and IT Engineering using insights which are both qualitative and quantitative to develop impactful strategies.Your Role & ResponsibilitiesProduce concepts, wireframes, prototypes and visuals across the full lifecycle of a projectBeing an advocate for a Lean UX approach and rapid prototyping to quickly present, test and iterate ideasEmbrace user research and usability testing, to shape decisions involving the whole team Always work mobile firstWork with design systems to produce deliverables with a consistent and outstanding user-experienceEnsure that the brand standards are met across all materials and devicesHelp in creating, maintaining, and evolving our visual design guidelines together with the rest of the UX team. Participate in design reviews and share your work regularly with the other designers.Use both qualitative and quantitative insights to influence and validate your team's work.Have excellent communication skills and people-focused design mentality to help set up frameworks and brainstorm initial design concepts.Be passionate about complex problems and experienced in data-informed product design and development.YOUR IDENTIKIT 4+ years of design and interactive workKnowledge of user-centered experience design, interaction design, Lean UX process, visual design and brand developmentDeep understanding and experience in all phases of the design process including user research, ideation, wireframing, prototyping, UX design, UI design, and usability testingExperience with data-driven designSolid understanding of iOS and Android design guidelines and mobile UX principlesA deep attention to detail to proper deliveryToolset includes Sketch, InVision and Zeplin An online portfolio or samples of work demonstrating a history of creating customer-focused, simple and intuitive designsBe an exceptional team player, communicator and facilitatorAbility to take initiative within the remote environmentComfortable working in a fast-paced iterative/agile design process based on daily feedback loopsExcellent ability to communicate in EnglishWhat We OfferFull-time employment with flexible working hours and smart working up to 5 days per week€ 300 Gift Card for your remote workstation Competitive total remunerationWork with OKRs goal setting framework Personal training budget to attend conferences and eventsChallenging collaboration with global teamsInternational career and growth opportunitiesWork with cutting-edge technologies and assetsHealthcare plan, welfare plan and wellbeing initiativesTicket restaurant (even if you work remotely)Break with healthy fruits, beverages and coffee (when you work from the office)Relaxing area with ping-pong and foosball, of course…We would kindly ask you to please add your portfolio (file or link), when submitting your application.This announcement is addressed to both sexes, pursuant to laws 903/77 and 125/91, and to persons of all ages and nationalities, in accordance with the legislative decrees 215/03 and 216/03.QualificationsAdditional InformationBy submitting your interest in this job, you agree to receive text notifications with additional steps to complete your job application. You will receive up to 6 messages from the number ""63879"". Message & data rates may apply. Please refer to our privacy policy for more information.",Associate,Full-time,Information Technology,Information Technology and ServicesComputer SoftwareInternet
2478275424,2021-03-01,PANERAI Graphic,Motion and Graphic Designer - Chinese market,"Milan, Lombardy, Italy","Panerai is a high-end status sports watch brand that operates in a niche segment, fully exploiting its values of belonging that allow Panerai owners to feel part of an exclusive club.The fundamental values of Panerai are based on history and the sea world, authenticity, exclusivity and rarity, product identity, Italian design and Swiss technology.We are looking for a creative in-house Motion and Graphic Designer with consolidated experience in content creation of the Chinese Market, to join our Creative Department based in Milan.The successful candidate will bring stories and contents to life by creating highly creative, visually compelling and emotionally engaging videos and designs. The ideal candidate has a portfolio/showreel and passion for visual storytelling.Our candidate will have to bring creative proposals mainly dedicated to the Chinese market, therefore the knowledge of the Chinese market & Culture will be a key asset for this role. In terms of activities performed on a daily basis, the candidate is engaged in: the development of assets that require motion design solutions, such as animated logos, animated graphics, composite videos for social media use.  the development of powerful video animations for multiple platforms.  the development of graphic materials such as social media graphics and visuals, banners, posters, advertising.Requirements Degree and/or post-graduate degree in Design or equivalent working experience as a professional graphic designer (ideally, 3-5 years)  Native language Chinese  Fluent in English, written and spoken  Working experience with Chinese companies / clientsTechnical Skills Proficiency with Adobe Premiere, Adobe After Effects  Proficiency with Adobe CS Suite (InDesign, Illustrator, Acrobat and Photoshop)  Good use of Sketch/ Adobe XD  Video editing, audio and video post production, 2D motion graphic  Microsoft Office Suite (Power Point, Word)  High level of attention to quality and details  Keen ability to take criticism and incorporate feedback to achieve more effective design solutions  Good time management and multitasking abilities in a fast-paced environmentAdditional Skills That Will Be Considered a Plus Knowledge of 3D Softwares would be an advantage but not essential for the role",Entry level,Full-time,DesignArt/CreativeInformation Technology,Marketing and AdvertisingDesignGraphic Design
