Job ID,Date,Company Name,Post,Location,Description,Level,Type,Function,Industry
2448413948,2021-03-22,La DoubleJ Graphic,Graphic Designer,"Milan, Lombardy, Italy","GRAPHIC DESIGNER  We are looking for a strong, super talented Graphic Designer to join La DoubleJ team in Milano. This team member must bring a passion for graphic design, typography, color, and paIern to the role. Strong typographic skills are particularly important.This mid-level designer will be responsible for graphic design projects—small, medium, and large—ranging from digital catalogs and lookbooks to digital and content initiatives, and from retail and collaboration collateral to digital and video training tools. She/He must have experience working in a fast-paced design-driven fashion or lifestyle business.The Graphic Designer will report to the Artistic Director and will work collaboratively with the product, production, and digital/social teams to deliver the freshest creative solutions and highest quality work.  What you’ll do: Address creative briefs and present concepts and design solutions.Design both digital and print assets.Handle multiple, small, quick turn-around collateral projects while also thinking about larger scale projects, ranging from catalogs to pop-up concepts to retail store, sales, and training collateral.Manage production processes and the ability to communicate with vendors and suppliers to complete production.Responsible for the final creative delivery and proofing of all projects.What we’re looking for: +5 years of successful experience as a Graphic Designer in a highly creative, fashion/lifestyle digital first ecomm business.Ability to work quickly and nimbly with a small team on a project-by-project basis.Proven excellent presentaJon and communicaJon skills, and ability to work and interact with internal and external stakeholders.Up-to-date on the latest trends in fashion and lifestyle spaces, as well as plugged into culture and the design worldExcellent organizational skills; able to prioritize and multi-task various and challenging demands.Have strong Adobe Suite skills (inDesign, Illustrator, Photoshop, Bridge, etc.).Strong interest in animation, motion graphics, and film editing a plus.Excellent English skills (mother tongue or bilingual); fluent in Italian.About La DoubleJ Our WorldLa DoubleJ is a multi-tasking Milanese brand that edits the very best of Italy. Founded by J.J. Martin in 2015, the company has expanded from a shoppable magazine selling just vintage clothing and jewelry, to a full lifestyle label offering new fashion made with archival prints, cool home design and rare vintage. All of La DoubleJ’s creations—from its content, editorial projects and pop up shops, to its product design and wildly patterned showroom in Milan—are distilled through a lens of pure joy, eye-popping print and love of all things maximal and dedicated to all the Great Gorgeous Girls who rock it with style.Our LeaderLos Angeles-born, Milan-based journalist and vintage collector J.J. Martin has spent the past 16 years scoping out the very best of Italian fashion and design as a contributing editor at Harper’s Bazaar USA, WSJ, and Wallpaper magazines. Her writing has also appeared in T: The NY Times Style Magazine, Japanese Vogue, AD and Elle Décor. Now Martin translates her experience as an editor into discovering hidden archives, curating under-the-radar talent, and shining the light on Italy’s unsung historic producers as creative director for La DoubleJ.",Mid-Senior level,Full-time,DesignArt/CreativeInformation Technology,Apparel & FashionInternet
2434557534,2021-03-22,NTT DATA Italia Graphic,Full stack Developer (5949),"Milan, Lombardy, Italy","NTT DATA è alla ricerca di candidati con passione per la tecnologia, spirito innovativo e determinazione per costruire assieme i canali digitali (Web, Mobile, Intranet, canali innovativi) dei nostri clienti: le principali aziende italiane ed internazionali in ambito Telco, Finance, Media, Energy, Industria, Pubblica Amministrazione. Responsibilities:Il profilo di riferimento è Full stack Developer, il cui ruolo è di: definire, disegnare ed implementare l'architettura dei canali digitali, considerando i vincoli imposti dall'ecosistema complessivosviluppare componenti e soluzioni di frontend e backendprogettare e implementare la struttura dati di riferimento per la soluzioneProgettare e implementare le API consumate dal frontendSoddisfare i requisiti tecnologici e di business, con visibilità E2E della soluzioneTenersi aggiornato sulle evoluzioni tecnologiche in ambito web application e linguaggi di programmazione, agendo da punto di riferimento per il team Required Skills: HTML, CSS, Javascript e Typescriptframwork javascript (ad es. Angular, React)linguaggo java e framework Spring, Springboot e JPADatabase MongoDB ed OracleOttime capacità di problem solving Nice to have:Conoscenza di architetture a microfrontendFamiliarità con l'approccio DevOps e conoscenza dei relativi tool I team di lavoro prevedono interazioni continue tra Frontend e Backend developer, Graphic Designer e User Experience Designer, e frequenti momenti di confronto con il cliente. Per questo sono richieste eccellenti capacità relazionali e una modalità di comunicazione efficace. E' preferibile, anche se non mandatoria, una Laurea in discipline scientifiche. Sede di lavoro: Milano.",Entry level,Full-time,Business DevelopmentConsultingInformation Technology,Information Technology and Services
2418229121,2021-03-21,LivaNova Graphic,Senior Product Designer,"Milan, Lombardy, Italy","Join us today and make a difference in people's lives!Epsy is a leading digital health platform, on a mission to accelerate the path to optimal treatment for everyone living with epilepsy. Winner of Google Material Design Awards 2020 and CES Innovation Awards 2021, Epsy is focused on incorporating the latest technologies and state-of-the-art data analysis into user-centric experiences, ultimately making life with epilepsy brighter for patients, their caregivers and healthcare professionals.We’re searching for a  Senior Product Designer  to help us reach our ambitious goals. Reporting directly to the Head of Design and working as part of the PED (Product, Engineering, Design) team, you will be responsible for identifying user insights and translating solutions into the best experiences in our product.We are looking to hire in London but if you have an  exceptional portafolio, live in an European location and for any reason are not able to relocate, we would like to hear from you anyway. We are willing to evaluate a remote position.Your Roledefine hypothesis, construct and run user research activities to uncover key user needs and behaviorsunite teams across the business to share learnings, ensuring user insights are translated into the productinnovate in solutions and approach, to scope and deliver to the product roadmap and strategic business goalsexecute and deliver self-led projects, from concepts and user journeys, to wireframes and high fidelity prototypeswork closely with the engineering team to ensure quality and timely execution of design work into live productregularly demo new features and flows to senior stakeholders, providing a clear rationale for design decisionsRequired Skills And Experienceseveral years in product design, delivering end-to-end projects in UX and UI disciplines within start-up and agile environmentsan outstanding portfolio of work that demonstrates strong user-centered design capabilities across a range of projectsdeep subject matter expertise in research and testing techniques, able to discern which practice to use for which activitydriven by data and customer insights, having worked with product managers to track and analyse live productsexcellent communication skills, motivated to learn and work autonomously, but value team collaboration and keen to mentor advanced prototyping abilities with Figma, Sketch, Adobe XD, Marvel and InVision  animation experience in programmes like After Effects a plus  experience in healthcare, as a strong plus  Why work for Epsy? We operate as an independent startup within a large corporate, the LivaNova group. This gives us unique advantages: we move fast and drive growth, while benefiting from the corporate umbrella for excellent funding and resources. Epsy Health is headquartered in London (UK) and Houston (Texas, USA), and our team has fully embraced remote work for the long-term.We’re a team of designers, app developers, product managers, marketeers, customer success managers and data analysts. We pride ourselves on our all-team collaborative approach and actively encourage learning, whether it be in your specialty or simply an area you might like to know more about (examples include talks about hedge fund management and wine!). If you are looking to develop in a supportive team who actively strives to better the lives of millions of people, then Epsy is the place for you.Here is an illustrative list of what you can expect at Epsy: Flexible work from home arrangements  Pension contribution  Cycle to work scheme  Private medical insurance/eye care  Employee Assistance Program (EAP): core resources available with additional access to discounted merchandise and a Wellbeing Assessment  Company sick p ay  Life assurance  Gym membership  Company shares purchase program Long Service – extra day off for each year of service MacBook Pro and software you need to work effectively  Supportive senior leadership and enthusiastic atmosphere throughout the company  Opportunities to shine with our various collaborative team meetings Lots of fun virtual events like pizza-making and wine tastingOur Commitment To Diversity & InclusionLivaNova values equality and celebrates diversity. We are committed to ensuring that our recruitment process is fair, transparent and free from unlawful discrimination.Our selection process is driven by the key demands/requirements for the role rather than bias or discrimination on the basis of a candidate’s sex, gender identity, age, marital status, veteran status, non-job-related disability/handicap or medical condition, family status, sexual orientation, religion, color, ethnicity, race or any other legally protected classification. Background Checks At LivaNovaUpon successful completion of the hiring process an offer may be extended. Please note, LivaNova reserves the right to conduct background investigations and/or reference checks on all its potential employees, where permitted by local legislation. This offer therefore, is contingent upon a clearance of such a background investigation and/or reference check, and can be rescinded, where permitted by local legislation, based upon data received in the background check and/or refusal to cooperate with or any attempt to affect the results of this check. This process is not currently valid in Germany.Notice To Third Party AgenciesPlease note that we do not accept unsolicited resumes from recruiters or employment agencies. In the absence of a signed Recruitment Services Agreement, we will not consider, or agree to, payment of any referral compensation or recruiter fee. In the event that a recruiter or agency submits a resume or candidate without a previously signed agreement, we explicitly reserve the right to pursue and hire those candidate(s) without any financial obligation to the recruiter or agency.",Associate,Full-time,EngineeringInformation Technology,Information Technology and ServicesMedical DevicesHospital & Health Care
2447250825,2021-03-21,Officine Panerai Graphic,Motion and Graphic Designer - experienced in Chinese market,"Milan, Lombardy, Italy","We are looking for a creative in-house Motion and Graphic Designer with consolidated experience in content creation of the Chinese Market, to join our Creative Department based in Milan. The successful candidate will bring stories and contents to life by creating highly creative, visually compelling and emotionally engaging videos and designs. The ideal candidate has a portfolio/showreel and passion for visual storytelling. Our candidate will have to bring creative proposals mainly dedicated to the Chinese market, therefore the knowledge of the Chinese market & Culture will be a key asset for this role. In terms of activities performed on a daily basis, the candidate is engaged in: the development of assets that require motion design solutions, such as animated logos, animated graphics, composite videos for social media use. the development of powerful video animations for multiple platforms. the development of graphic materials such as social media graphics and visuals, banners, posters, advertising.  Requirements: Degree and/or post-graduate degree in Design or equivalent working experience as a professional graphic designer (ideally, 3-5 years) Native language Chinese Fluent in English, written and spoken Working experience with Chinese companies / clients  Technical Skills: Proficiency with Adobe Premiere, Adobe After Effects Proficiency with Adobe CS Suite (InDesign, Illustrator, Acrobat and Photoshop) Good use of Sketch/ Adobe XD Video editing, audio and video post production, 2D motion graphic Microsoft Office Suite (Power Point, Word) High level of attention to quality and details Keen ability to take criticism and incorporate feedback to achieve more effective design solutions Good time management and multitasking abilities in a fast-paced environment  Additional Skills That Will Be Considered a Plus: Knowledge of 3D Softwares would be an advantage but not essential for the role",Mid-Senior level,Full-time,Design,Luxury Goods & Jewelry
2445738189,2021-03-19,TRUSSARDI Graphic,Stage Web Developer & Graphic Designer,"Milan, Lombardy, Italy","Trussardi SPA, primario brand del fashion e del life style, per rafforzamento del proprio team Digital/E-commerce, è alla ricerca di uno Stage web developer & graphic designer, che supporti la struttura nello sviluppo della piattaforma.Nello specifico la risorsa si occuperà di:Supporto allo sviluppo di newsletter responsive:Creazione layout per le comunicazioni newsletterSviluppo HTML, test e invioAnalisi dei principali KPIsDefinizione e aggiornamento del calendario newsletter, in coordinamento con le altre funzioniAggiornamento periodico di contenuti e landing page per il sito webCreazione di banner e Gif animateCoordinamento con altre funzioni e/o agenzie esterne quando necessario La risorsa inserita avrà la possibilità di lavorare sulle piattaforme Salesforce, di imparare ad utilizzare numerosi tool e di acquisire competenze strategiche per il mondo e-commerce. Lavorerà in un contesto giovane, dinamico e in crescita.Siamo alla ricerca di un giovane dinamico, intraprendente e curioso, con una forte propensione al mondo del digitale e alle nuove piattaforme/tecnologie.Ci piacerebbe incontrare candidati che abbiano:un percorso di formazione in ambito digital/designconoscenza di Adobe Creative Cloud (Photoshop, Illustrator, Dreamweaver)conoscenza base di HTML e CSSottima conoscenza della lingua ingleseDeterminazione, voglia di imparare, precisione, puntualità ed affidabilità, sono caratteristiche imprescindibili.È considerato un plus la conoscenza di altri tool di design (XD, Sketch, MediaEncoder, PremierPro).Si richiede di fornire un portfolio lavori (pdf o website)",Internship,Full-time,Art/CreativeSalesMarketing,Apparel & Fashion
2445726059,2021-03-19,ProntoPro Graphic,UX/UI Product Designer,"Milan, Lombardy, Italy","About UsProntoPro.it is Italy's largest local service marketplace, expanding internationally. We help millions of users to find a local service professional: we cover 600+ services, ranging from wedding photographers to plumbers to guitar teachers. Within a few years, we expect that booking a plumber or a painter online will be as effortless as buying a book. We were born as a startup and even though we are experiencing an advanced phase of growth, the startup agility still guides our processes and decisions.  We don’t like bureaucracy - data in hand, we prefer to act and experiment rather than procrastinate. It’s more efficient to make mistakes and learn from them rather than remain stable and wait unless we become perfect.We are obsessed with learning - dedication, hardworking and openness to feedback are the clues to constant self-improvement and innovation. We are proud of our international and informal environment. Our employees come from all over the world - there are more than 16 different nationalities at ProntoPro, English is our first language. We work hard and have fun at work!ProntoPro has always been supported by successful investors and entrepreneurs. Being a part of Immobiliare.it network lets us develop innovative solutions without typical start-up risks. We are looking for people who want to bring impact and help us build something huge that will challenge the way all of your friends and family look for services. Working as a DesignerYou will be part of our Design Team, currently counting 6 people and expected to grow bigger in 2021.You will join a multidisciplinary team composed of UX/UI Designers, Visual Designers and Copywriters.In ProntoPro’s Design Team we take our pride in delivering the best experience with a tidy, trustworthy and transparent Product.The main responsibility of the Design team is to envision, create and test solutions to help our customers succeed.We collaborate every day with Product Management & User Research in discovering the most relevant customer experience problems, and finding new ways to solve them.Designers in the team own their design process end-to-end, from framing & concept development to delivery & iteration.RequirementsYou have a minimum of 5 years of applied experience in UX and UI DesignYou are a Master of Design Systems: you are obsessed with components specifications and patterns consistency.You are capable of delivering high quality icons, illustrations and UI animations.You are solution-oriented. These qualities are used in your passion for solving customer problems.You have a growth mindset and are constantly learning new thingsYou have a critical eye and are known for your attention to detail and pixel perfection (AND have a portfolio that shows this!)You master tools such as Sketch, InVision, Zeplin, Figma, etc.You can work on a tight schedule to deliver high quality workYou are able to lead multiple projects and tasks at a timeYou are fluent in English - as well as a fantastic communicatorResponsibilitiesProntoPro has an exceptionally ambitious goal and achieving this goal requires significant product evolution. Despite our incredible growth, we are still missing THE perfect product-market fit. This is where you come in. Along with the rest of the team your personal goal will be to achieve this fit. Let's dive a bit deeper into what this means:You will be responsible for a product that is used across all of ProntoPro's marketsYou will conceive, design and prototype new UIs and UXs - all with the aim to continuously improve our productYou will occasionally run user test sessions and interviewsYou will document solutions and participate in their implementationYou will maintain and expand our Design SystemYou will not be alone - in collaboration with product management, business intelligence and engineers you goal is to implement solutionsWorkplacesOur tech teams are distributed among the following headquarters:Milan: via Carlo Farini, 41Rome: via Marsala, 29/h We have flexible working hours and give you the possibility to work from home when you prefer to. Working from our offices means:Terraces and relax areasFoosball and ping-pong tablesCoffee machinesFresh fruitIntelligent fridge with delicious food available 24/24Lunch tickets Casual Friday every dayFriday beer at 5 p.m.",Mid-Senior level,Full-time,Information Technology,Information Technology and Services
2468526116,2021-03-19,e-Novia Graphic,Specialist Visual Designer // e-Novia,"Milan, Lombardy, Italy","As a Specialist Visual Designer, you will be involved in multidisciplinary innovation projects where you will apply both your technical skills and supporting your colleagues with your experience. You'll be the go-to figure for complex and challenging projects, and you'll get in the way of colleagues from other business areas. You will report to the Head of Product Design.Main Areas Of ActivitiesCollaborate with the design and communication teams to envision new conceptCollaborate to define communication strategiesLead Projects With a Hands-on Approach On Different TopicsBrand IdentitySocial media contentsPhoto and video contentsAdvertisingNew UX and graphics for eventsContribute to improving processesBuild and consolidate the customer relationship managing client expectationsEstimate effort and plan resourcesEnsure compliance with estimates and deadlinesIdentify, qualify and manage external suppliersRequired Background And Technical SkillsTechnical competences: wide knowledge on branding (positioning, identity, strategy, collaterals etc.), traditional marketing materials (whitepapers, annual reports, ads, web design, etc.) social media and multimedia contents (photos, videos, motion graphics animations…), exhibition designTools: excellent knowledge of Adobe Suite: Photoshop, Illustrator, In-Design, After Effect, Premier; good knowledge of the Microsoft Office Suite.Other Skills And Required CharacteristicsEducation: Master's degree in visual communication design or equivalent qualificationWork experience: more than 6 years of work experience in similar position or with similar duties with at least 2 year in a design team lead position in a creative design studio/agencyLanguages: English (B2), knowledge of other languages is a plusPersonal skills: Strong leadership and collaboration skills; Comfortable working in a fast-paced environment with multiple work streams; Proactive in sharing insights; Interested in emerging trends; Amazing communication and presentation skills; Extremely collaborative; Creative spirit with entrepreneurial attitude;Travel: Available to business trips in Italy and abroadWe OfferFull time contractCompensation in line with organizational role and individual competences and experienceHealthcare packWelfare packFast and meritocratic professional growingCustomized Laptop and toolsPersonalized training on the most innovative technologiesParticipation to the most important international eventsGrowth within a team to be proud ofInterested candidates apply by filling the form below this post.Resumes must include a proper written authorization for the treatment of personal identification data in accordance with GDPR (UE Regulation 2016/679).As part of your application, please include a link or PDF of your portfolio of recent works.E-Novia is an equal opportunity employer: this job posting is open to both sexes in accordance with the Italian legislative decree no. 198/2006.",Entry level,Full-time,Information Technology,Electrical/Electronic ManufacturingComputer SoftwareAutomotive
